{
  "attestation_version": 1,
  "payload_type": "portable_artifact",
  "payload": {
    "artifact_version": 1,
    "rung": "source",
    "source_id": "src_soc2",
    "derived_only_nodes": [],
    "passages": [],
    "internal_edges": [],
    "boundary_stubs": [],
    "boundary_edges": []
  },
  "payload_hash": "sha256:e3b0c44298fc1c149afbf4c8996fb92427ae41e4649b934ca495991b7852b855",
  "signed_at": "2026-06-13T00:00:00+00:00",
  "signed_by": "did:web:conformance.example",
  "key_id": "ed25519:0123456789abcdef",
  "public_key": "bm90LWEtcmVhbC1wdWJsaWMta2V5",
  "signature": "bm90LWEtcmVhbC1zaWduYXR1cmU="
}
